{"schemaVersion":2,"runId":"luna-terra-sol-batch-02-2026-07-16","stage":"sol_review","model":{"id":"gpt-5.6-sol","reasoningEffort":"medium"},"restaurantId":"bangkok-54-arlington-dc-metro","verifierOutcome":"low_confidence","recommendation":"repair_required","confidence":{"level":"high","score":0.97,"rationale":"Primary restaurant and restaurant-linked sources clearly demonstrate a live catalog, explicit narrow Pad Thai positives, an incomplete-ingredient warning, and no item-specific cross-contact statement. The failed zero-product extraction makes complete reconciliation unverifiable."},"confirmedFindings":["Affected baseline items are 46:drunken-noodles, 47:drunken-noodles-bowl, 49:drunken-noodles-tray, 143:pad-thai-bowl, 145:pad-thai-noodles, and 213:spring-rolls. The packet reports 262 reconciled and 262 unique items, all classified missing_from_source/accurately_unavailable, with zero duplicates, but every reconciliation is non-exact and baseline-only.","The official site and linked Toast catalog identify Bangkok 54 Restaurant & Bar at 2919 Columbia Pike, separately from Bangkok 54 Market.","The linked Toast catalog is active and contains numerous food, sushi, beverage, seasonal, and catering products. Luna's zero-product and zero-presentation extraction is invalid, confirming scope_incomplete, count_drift, baseline_only, non_exact_reconciliation, parser_or_repair_finding, and low_confidence risk.","Pad Thai Noodles explicitly names egg and crushed peanuts on both the restaurant-issued menu and linked Toast catalog. These are valid narrow positive ingredient findings, not a complete allergen array.","Spring Rolls and Drunken Noodles are current named products, and Drunken Noodles Tray and Pad Thai Noodles Tray are separately listed current catering products.","The restaurant explicitly warns that not all ingredients are listed. Therefore omitted allergens cannot support negatives or an empty complete allergen array.","The restaurant states that gluten-containing products are prepared in its kitchens, but this is not an item-specific may-contain or cross-contact assertion.","Multiple dinner, lunch, sushi, ordering, and catering surfaces confirm the multi_service and scout_flagged_risk gates."],"rejectedFindings":["Rejected any interpretation of empty allergen arrays for Spring Rolls or Drunken Noodles as evidence that those products contain no major allergens.","Rejected promotion of the global gluten-kitchen statement into item-level mayContain values or a definitive cross-contact conclusion.","Rejected treating Toast-only evidence as restaurant-issued evidence. Toast is a restaurant-linked vendor, although the restaurant-issued menu independently supports egg and peanut for Pad Thai Noodles.","Rejected Terra's non-exact mapping of the single base Drunken Noodles presentation to both the Bowl and Tray records, and of base Pad Thai Noodles to Pad Thai Bowl. Toast separately lists the catering trays, while no current exact Bowl presentation was located.","Rejected Terra's three-product discovery set as a complete representation of the current catalog; the reopened Toast page contains substantially more current products.","Rejected the blanket adjudication of all 262 baseline items as accurately unavailable: the current sources directly establish many named products, while the empty scout inventory prevents item-by-item reconciliation."],"additionalEvidence":[{"url":"https://bangkok54restaurant.com/menu/","authorityTier":"restaurant_issued","summary":"Official menu names egg and crushed peanuts for Pad Thai Noodles, lists Spring Rolls and Drunken Noodles, warns that not all ingredients are listed, and states only that gluten-containing products are prepared in the kitchens."},{"url":"https://order.toasttab.com/online/bangkok-54-restaurant","authorityTier":"restaurant_linked_vendor","summary":"Live linked catalog confirms a broad current inventory, including Pad Thai Noodles, Spring Rolls, Drunken Noodles, Pad Thai Noodles Tray, and Drunken Noodles Tray."},{"url":"https://bangkok54restaurant.com/","authorityTier":"restaurant_issued","summary":"Official homepage confirms the restaurant identity and address and distinguishes the separate market."}],"summary":"The six affected baseline items sit within a defective reconciliation of 262/262 baseline-only, non-exact items classified missing_from_source/accurately_unavailable. The effective outcome remains low_confidence. Terra correctly identified the empty scout extraction and incomplete allergen evidence, but its reconciliation is not usable, its three-product discovery is incomplete, and some presentation matches are non-exact. Explicit Pad Thai egg and peanut positives remain valid; negatives, complete arrays, and item-level cross-contact conclusions do not.","coordinatorActions":["Repair the current-product extraction/parser and rerun complete enumeration against the live Toast catalog and official menu surfaces.","Reconcile base, bowl, tray, lunch, and catering presentations separately using exact product identities.","Preserve egg and peanut as narrow positive evidence for exact Pad Thai Noodles presentations, with restaurant-issued authority where supported by the official menu and linked-vendor authority where supported only by Toast.","Keep allergen status unavailable for items lacking explicit positive evidence; do not infer negatives from omitted ingredients.","Do not populate item-level mayContain values from the global gluten-kitchen statement.","Re-run deterministic counts and risk gates after extraction repair before any codex_verified decision."]}